{
  "$schema": "http://json-schema.org/draft-07/schema#",
  "$id": "https://github.com/jacbeekers/metadata-registry-interface-specifications/blob/master/metadata/schemas/interface/0.2.0/physical_attribute_assoc.json",
  "title": "Physical Entity Association",
  "description": "The association of two (or more) physical attributes",
  "required": [
    "meta",
    "meta_version",
    "uid",
    "name",
    "version",
    "physical_entity_association",
    "source_target_attribute_links"
  ],
  "type": "object",
  "properties": {
    "meta": {
      "type": "string",
      "description": "metadata type",
      "enum": [
        "physical_attribute_association"
      ]
    },
    "meta_version": {
      "type": "string",
      "description": "the meta structure version for the object",
      "pattern": "^([0-9]+).([0-9]+).*$"
    },
    "uid": {
      "description": "The unique identifier for the association",
      "type": "string",
      "format": "uuid"
    },
    "name": {
      "description": "The name of the association for later referral",
      "type": "string"
    },
    "version": {
      "description": "The version number of the association",
      "pattern": "^([0-9]+).([0-9]+).([0-9]+)$",
      "type": "string"
    },
    "physical_entity_association": {
      "oneOf": [
        {
          "type": "string",
          "format": "uuid",
          "pattern": "^(.+)-(.+)-(.+)$"
        }
      ],
      "description": "To which this attribute association belongs"
    },
    "source_target_attribute_links": {
      "type": "array",
      "items": {
        "$ref": "#/definitions/source_target_attribute_link"
      },
      "uniqueItems": true
    }
  },
  "definitions": {
    "source_target_attribute_link": {
      "type": "object",
      "required": [
        "transformation"
      ],
      "properties": {
        "transformation": {
          "$ref": "#/definitions/transformation"
        },
        "description": {
          "type": "string",
          "description": "Explanation of the transformation"
        },
        "formula": {
          "type": "string",
          "description": "Formula applied to the attributes. Use the names or UUIDs of the attributes and place it in {{}}, e.g. '{{LastName}}' or '{{19aee165-025c-4358-97ed-08ba90910c47}}'"
        }
      }
    },
    "transformation": {
      "type": "object",
      "required": [
        "uid",
        "from",
        "to"
      ],
      "properties": {
        "uid": {
          "type": "string",
          "description": "The transformation id. Use the same id when multiple source attributes lead to the same target attribute"
        },
        "from": {
          "type": "array",
          "items": {
            "oneOf": [
              {
                "type": "string",
                "format": "uuid",
                "pattern": "^(.+)-(.+)-(.+)$"
              }
            ]
          },
          "description": "The source attributes (or existing references to it/them)"
        },
        "to": {
          "oneOf": [
            {
              "type": "string",
              "format": "uuid",
              "pattern": "^(.+)-(.+)-(.+)$"
            }
          ],
          "description": "The target attribute (or existing reference to it)"
        }
      }
    }
  }
}